objectid,filename,title,creator,date,physicaldescription,dimension,source,format,see full scroll here,location(dongpo red cliff),latitude,longitude
image1,image1.jpg,Copy after Zhao Bosu’s Latter Prose Poem on the Red Cliff,Wen Zhengming,Yuan Dynasty(1271~1368),"handscroll, ink and color on paper",31.5 x 541.6 cm,"National Palace Museum, Taibei",image/jpeg,https://theme.npm.edu.tw/exh106/npm_anime/RedCliff/en/index.html,"Huangzhou District, Huanggang, Hubei, China",30.45301,114.87998
image2,Image2.jpg,Former Prose-Poem on the Red Cliff,Li Song,Southern Song Dynasty (960~1279),"fan, ink and color on silk",24.8 x 26 cm,"The Nelson-Atkins Museum, Kansas City",image/jpeg,,"Huangzhou District, Huanggang, Hubei, China",30.45301,114.87998
image3,image3.jpg,Latter Prose-Poem on the Red Cliff,Qiao Zhongchang,Northern Song Dynasty (960~1127),"handscroll, ink on paper",29.5x 560cm,"The Nelson-Atkins Museum, Kansas City",image/jpeg,https://scrolls.uchicago.edu/view-scroll/232,"Huangzhou District, Huanggang, Hubei, China",30.45301,114.87998
image4,image4.jpg,Latter Prose-Poem on the Red Cliff,Ma Hezhi,Southern Song Dynasty (960~1279),"handscroll, ink and color on silk",25.9 x143 cm,"Palace Museum, Beijing",image/jpeg,https://www.dpm.org.cn/collection/paint/231500.html,"Huangzhou District, Huanggang, Hubei, China",30.45301,114.87998
image5,image5.jpg,Former Prose Poem on the Red Cliff,Wu Yuanzhi(attributed to),Jin Dynasty (1115~1234),"handscroll, ink on paper",50.8 x 136.4 cm,"National Palace Museum, Taibei",image/jpeg,https://digitalarchive.npm.gov.tw/Painting/Content?pid=32&Dept=P,"Huangzhou District, Huanggang, Hubei, China",30.45301,114.87998